[
  {
    "id": "knapsack_01",
    "name": "0-1 Knapsack Problem",
    "aliases": [
      "knapsack",
      "binary knapsack",
      "0/1 knapsack"
    ],
    "description": "Given items with weights and values, select a subset of items to put in a knapsack of limited capacity so that total value is maximized and total weight does not exceed capacity. Each item can be taken at most once.",
    "formulation": {
      "variables": [
        {
          "symbol": "x_i",
          "description": "1 if item i is selected, 0 otherwise",
          "domain": "x_i ∈ {0,1} for each item i"
        }
      ],
      "objective": {
        "sense": "maximize",
        "expression": "Σᵢ vᵢ xᵢ  (sum of values of selected items)"
      },
      "constraints": [
        {
          "expression": "Σᵢ wᵢ xᵢ ≤ W",
          "description": "Total weight must not exceed knapsack capacity W"
        }
      ]
    },
    "formulation_latex": "\\max \\sum_i v_i x_i \\quad \\text{s.t.} \\quad \\sum_i w_i x_i \\le W,\\quad x_i \\in \\{0,1\\}.",
    "complexity": "NP-hard",
    "source": "classic"
  },
  {
    "id": "set_cover",
    "name": "Set Cover Problem",
    "aliases": [
      "set covering",
      "hitting set (dual)"
    ],
    "description": "Given a universe of elements and a family of subsets, choose the minimum number of subsets such that every element is contained in at least one chosen subset.",
    "formulation": {
      "variables": [
        {
          "symbol": "x_S",
          "description": "1 if subset S is chosen, 0 otherwise",
          "domain": "x_S ∈ {0,1} for each subset S"
        }
      ],
      "objective": {
        "sense": "minimize",
        "expression": "Σ_S x_S  (number of subsets chosen)"
      },
      "constraints": [
        {
          "expression": "Σ_{S : e ∈ S} x_S ≥ 1 for each element e",
          "description": "Every element must be covered by at least one chosen set"
        }
      ]
    },
    "formulation_latex": "\\min \\sum_S x_S \\quad \\text{s.t.} \\quad \\sum_{S : e \\in S} x_S \\ge 1 \\; \\forall e,\\quad x_S \\in \\{0,1\\}.",
    "complexity": "NP-hard",
    "source": "classic"
  },
  {
    "id": "vertex_cover",
    "name": "Vertex Cover",
    "aliases": [
      "minimum vertex cover",
      "node cover"
    ],
    "description": "Given an undirected graph, choose a minimum set of vertices such that every edge has at least one endpoint in the set.",
    "formulation": {
      "variables": [
        {
          "symbol": "x_v",
          "description": "1 if vertex v is in the cover, 0 otherwise",
          "domain": "x_v ∈ {0,1} for each vertex v"
        }
      ],
      "objective": {
        "sense": "minimize",
        "expression": "Σ_v x_v  (size of the vertex cover)"
      },
      "constraints": [
        {
          "expression": "x_u + x_v ≥ 1 for each edge (u,v)",
          "description": "Every edge must be covered"
        }
      ]
    },
    "formulation_latex": "\\min \\sum_v x_v \\quad \\text{s.t.} \\quad x_u + x_v \\ge 1 \\; \\forall (u,v) \\in E,\\quad x_v \\in \\{0,1\\}.",
    "complexity": "NP-hard",
    "source": "classic"
  },
  {
    "id": "facility_location_ufl",
    "name": "Uncapacitated Facility Location Problem",
    "aliases": [
      "UFL",
      "simple facility location",
      "warehouse location",
      "plant location"
    ],
    "description": "Given facilities with opening costs and customers with assignment costs to each facility, decide which facilities to open and assign each customer to one open facility to minimize total opening cost plus assignment cost.",
    "formulation": {
      "variables": [
        {
          "symbol": "y_i",
          "description": "1 if facility i is open, 0 otherwise",
          "domain": "y_i ∈ {0,1}"
        },
        {
          "symbol": "x_ij",
          "description": "1 if customer j is assigned to facility i, 0 otherwise",
          "domain": "x_ij ∈ {0,1}"
        }
      ],
      "objective": {
        "sense": "minimize",
        "expression": "Σᵢ fᵢ yᵢ + Σᵢⱼ cᵢⱼ xᵢⱼ  (opening + assignment costs)"
      },
      "constraints": [
        {
          "expression": "Σᵢ xᵢⱼ = 1 for each customer j",
          "description": "Each customer is assigned to exactly one facility"
        },
        {
          "expression": "xᵢⱼ ≤ yᵢ for each facility i and customer j",
          "description": "Assignment only to open facilities"
        }
      ]
    },
    "formulation_latex": "\\min \\sum_i f_i y_i + \\sum_{i,j} c_{ij} x_{ij} \\quad \\text{s.t.} \\quad \\sum_i x_{ij}=1 \\; \\forall j,\\quad x_{ij} \\le y_i \\; \\forall i,j,\\quad x_{ij},y_i \\in \\{0,1\\}.",
    "complexity": "NP-hard",
    "source": "classic"
  },
  {
    "id": "tsp",
    "name": "Traveling Salesman Problem",
    "aliases": [
      "TSP",
      "traveling salesman",
      "salesman problem"
    ],
    "description": "Given cities and distances between them, find a shortest tour that visits each city exactly once and returns to the start.",
    "formulation": {
      "variables": [
        {
          "symbol": "x_ij",
          "description": "1 if edge (i,j) is used in the tour, 0 otherwise",
          "domain": "x_ij ∈ {0,1} for i < j"
        }
      ],
      "objective": {
        "sense": "minimize",
        "expression": "Σ_{i<j} dᵢⱼ xᵢⱼ  (total distance of the tour)"
      },
      "constraints": [
        {
          "expression": "Σ_j: j>i x_ij + Σ_j: j<i x_ji = 2 for each city i",
          "description": "Each city has degree 2 in the tour"
        },
        {
          "expression": "Σ_{i,j ∈ S} x_ij ≤ |S| − 1 for each proper subset S of cities",
          "description": "Subtour elimination constraints"
        }
      ]
    },
    "formulation_latex": "\\min \\sum_{i<j} d_{ij} x_{ij} \\quad \\text{s.t.} \\quad \\text{degree } 2 \\; \\forall i,\\quad \\text{no subtours},\\quad x_{ij} \\in \\{0,1\\}.",
    "complexity": "NP-hard",
    "source": "classic"
  },
  {
    "id": "max_cut",
    "name": "Maximum Cut",
    "aliases": [
      "max cut",
      "maxcut",
      "maximum cut problem"
    ],
    "description": "Given an undirected graph with edge weights, partition the vertices into two sets so that the total weight of edges between the two sets is maximized.",
    "formulation": {
      "variables": [
        {
          "symbol": "x_i",
          "description": "1 if vertex i is in one side of the cut, 0 for the other",
          "domain": "x_i ∈ {0,1}"
        },
        {
          "symbol": "y_ij",
          "description": "1 if edge (i,j) is in the cut (endpoints on different sides)",
          "domain": "y_ij ∈ {0,1}"
        }
      ],
      "objective": {
        "sense": "maximize",
        "expression": "Σ_{(i,j)∈E} wᵢⱼ yᵢⱼ  (weight of edges in the cut)"
      },
      "constraints": [
        {
          "expression": "y_ij ≤ x_i + x_j and y_ij ≤ 2 − x_i − x_j for each edge (i,j)",
          "description": "y_ij = 1 iff x_i ≠ x_j"
        }
      ]
    },
    "formulation_latex": "\\max \\sum_{(i,j) \\in E} w_{ij} y_{ij} \\quad \\text{s.t.} \\quad y_{ij} \\le x_i + x_j,\\; y_{ij} \\le 2 - x_i - x_j,\\quad x_i, y_{ij} \\in \\{0,1\\}.",
    "complexity": "NP-hard",
    "source": "classic"
  },
  {
    "id": "bin_packing",
    "name": "Bin Packing Problem",
    "aliases": [
      "bin packing",
      "one-dimensional bin packing"
    ],
    "description": "Given items with weights and bins of fixed capacity, pack all items into the minimum number of bins so that the sum of item weights in each bin does not exceed capacity.",
    "formulation": {
      "variables": [
        {
          "symbol": "y_k",
          "description": "1 if bin k is used, 0 otherwise",
          "domain": "y_k ∈ {0,1}"
        },
        {
          "symbol": "x_ik",
          "description": "1 if item i is assigned to bin k, 0 otherwise",
          "domain": "x_ik ∈ {0,1}"
        }
      ],
      "objective": {
        "sense": "minimize",
        "expression": "Σ_k y_k  (number of bins used)"
      },
      "constraints": [
        {
          "expression": "Σ_k x_ik = 1 for each item i",
          "description": "Each item is in exactly one bin"
        },
        {
          "expression": "Σᵢ wᵢ x_ik ≤ C y_k for each bin k",
          "description": "Bin capacity C; only used bins count"
        }
      ]
    },
    "formulation_latex": "\\min \\sum_k y_k \\quad \\text{s.t.} \\quad \\sum_k x_{ik}=1 \\; \\forall i,\\quad \\sum_i w_i x_{ik} \\le C y_k \\; \\forall k,\\quad x_{ik}, y_k \\in \\{0,1\\}.",
    "complexity": "NP-hard",
    "source": "classic"
  },
  {
    "id": "shortest_path",
    "name": "Shortest Path (s-t)",
    "aliases": [
      "shortest path",
      "s-t shortest path",
      "min cost path"
    ],
    "description": "Given a directed graph with arc costs, a source s and a sink t, find a minimum-cost path from s to t.",
    "formulation": {
      "variables": [
        {
          "symbol": "x_ij",
          "description": "1 if arc (i,j) is on the path, 0 otherwise",
          "domain": "x_ij ∈ {0,1}"
        }
      ],
      "objective": {
        "sense": "minimize",
        "expression": "Σ_{(i,j)} cᵢⱼ xᵢⱼ  (total path cost)"
      },
      "constraints": [
        {
          "expression": "Σ_j x_sj − Σ_j x_js = 1",
          "description": "Net flow out of source is 1"
        },
        {
          "expression": "Σ_j x_tj − Σ_j x_jt = −1",
          "description": "Net flow into sink is 1"
        },
        {
          "expression": "Σ_j x_ij − Σ_j x_ji = 0 for each node i ≠ s,t",
          "description": "Flow conservation at intermediate nodes"
        }
      ]
    },
    "formulation_latex": "\\min \\sum_{(i,j)} c_{ij} x_{ij} \\quad \\text{s.t.} \\quad \\text{flow balance } 1 \\text{ at } s,\\; -1 \\text{ at } t,\\; 0 \\text{ else},\\quad x_{ij} \\in \\{0,1\\}.",
    "complexity": "P",
    "source": "classic"
  },
  {
    "id": "assignment",
    "name": "Assignment Problem",
    "aliases": [